{
 "schema": "awr.anchors.v1",
 "extends": "world",
 "world_id": "oryahovo-crop1",
 "anchors": [
  {"id": "ev_market_exit", "kind": "point", "category": "plaza", "profile": "person", "xy": [-48.0, 36.0], "seed": true, "label_zh": "西侧集市出口"},
  {"id": "ev_north_lane", "kind": "point", "category": "manual", "profile": "person", "xy": [-20.0, 30.0], "label_zh": "集市东侧小街"},
  {"id": "ev_parcel_spot", "kind": "point", "category": "manual", "profile": "person", "xy": [-28.0, 33.0], "label_zh": "小街包裹放置点"},
  {"id": "ev_nw_street", "kind": "point", "category": "manual", "profile": "person", "xy": [-5.0, -20.0], "label_zh": "西北街南段"},
  {"id": "ev_plaza", "kind": "zone", "category": "plaza", "profile": "person", "polygon": [[2.0, -52.0], [24.0, -52.0], [24.0, -30.0], [2.0, -30.0]], "public": true, "label_zh": "中心路口广场"},
  {"id": "ev_s_door", "kind": "door", "category": "entrance", "profile": "person", "xy": [30.0, -70.0], "building": "ev_building_s1", "public": true, "label_zh": "南楼西门"},
  {"id": "ev_plaza_kiosk", "kind": "point", "category": "manual", "profile": "person", "xy": [20.0, -60.0], "label_zh": "广场南侧报亭"},
  {"id": "ev_town_center", "kind": "zone", "category": "manual", "profile": "person", "polygon": [[-90.0, -110.0], [110.0, -110.0], [110.0, 60.0], [-90.0, 60.0]], "label_zh": "镇中心"}
 ],
 "remove": []
}
